{
  "schema": 1,
  "id": "vorlage-theme",
  "name": "Vorlage Theme",
  "version": "0.0.1",
  "kind": "theme",
  "description": {
    "de": "Beispiel für ein Theme, nur zum Kopieren.",
    "en": "Example theme, copy it to start your own."
  },
  "author": "KazemaRyukuro",
  "license": "MIT",
  "minKageVersion": "0.1.0",
  "platforms": [
    "windows",
    "linux"
  ],
  "permissions": {
    "list": []
  },
  "entry": "theme.json",
  "files": [
    {
      "path": "theme.json",
      "sha256": "0000000000000000000000000000000000000000000000000000000000000000",
      "size": 0
    }
  ]
}
